{
  "version": 1,
  "categories": {
    "basic": {
      "label": "Basic",
      "description": "Entry-level towers available from the start",
      "unlock_level": 0,
      "color": "#4CAF50"
    },
    "advanced": {
      "label": "Advanced",
      "description": "Enhanced towers unlocked through progression",
      "unlock_level": 10,
      "color": "#2196F3"
    },
    "specialist": {
      "label": "Specialist",
      "description": "Situational towers with unique mechanics",
      "unlock_level": 18,
      "color": "#9C27B0"
    },
    "legendary": {
      "label": "Legendary",
      "description": "Unique powerful towers with special requirements",
      "unlock_level": 30,
      "color": "#FFD700"
    }
  },
  "towers": {
    "tower_arrow": {
      "name": "Arrow Tower",
      "description": "Fires arrows at enemies. Effective against unarmored targets.",
      "category": "basic",
      "footprint": [1, 1],
      "base_cost": {"wood": 4, "stone": 8},
      "base_stats": {
        "damage": 10,
        "range": 4,
        "attack_speed": 1.0,
        "shots_per_attack": 1,
        "damage_type": "physical",
        "target_type": "single"
      },
      "word_bonus": {
        "condition": "starts_with_A",
        "effect": {"damage_multiplier": 1.2}
      },
      "terrain_bonuses": {
        "elevated": {"range": 1}
      },
      "blocks_movement": true,
      "visual": {
        "sprite_id": "bld_tower_arrow",
        "projectile_id": "proj_arrow"
      }
    },
    "tower_magic": {
      "name": "Magic Tower",
      "description": "Fires arcane bolts that ignore enemy armor.",
      "category": "basic",
      "footprint": [1, 1],
      "base_cost": {"wood": 6, "stone": 10, "gold": 10},
      "base_stats": {
        "damage": 15,
        "range": 5,
        "attack_speed": 0.7,
        "shots_per_attack": 1,
        "damage_type": "magical",
        "target_type": "single",
        "armor_pierce": true
      },
      "word_bonus": {
        "condition": "has_double_letters",
        "effect": {"damage_multiplier": 1.15}
      },
      "terrain_bonuses": {
        "arcane_node": {"damage": 4}
      },
      "blocks_movement": true,
      "visual": {
        "sprite_id": "bld_tower_magic",
        "projectile_id": "proj_arcane_bolt"
      }
    },
    "tower_frost": {
      "name": "Frost Tower",
      "description": "Chills enemies, slowing their movement.",
      "category": "basic",
      "footprint": [1, 1],
      "base_cost": {"wood": 5, "stone": 8},
      "base_stats": {
        "damage": 5,
        "range": 3,
        "attack_speed": 0.8,
        "shots_per_attack": 1,
        "damage_type": "cold",
        "target_type": "single",
        "slow_percent": 25,
        "slow_duration": 2.0
      },
      "word_bonus": {
        "condition": "contains_ice_cold",
        "effect": {"slow_percent_bonus": 10}
      },
      "terrain_bonuses": {},
      "blocks_movement": true,
      "visual": {
        "sprite_id": "bld_tower_frost",
        "projectile_id": "proj_frost_shard"
      }
    },
    "tower_cannon": {
      "name": "Cannon Tower",
      "description": "Fires explosive shells with area damage.",
      "category": "basic",
      "footprint": [2, 2],
      "base_cost": {"wood": 8, "stone": 15, "gold": 15},
      "base_stats": {
        "damage": 25,
        "range": 4,
        "attack_speed": 0.4,
        "shots_per_attack": 1,
        "damage_type": "physical",
        "target_type": "aoe",
        "aoe_radius": 1
      },
      "word_bonus": {
        "condition": "length_6_plus",
        "effect": {"damage_multiplier": 1.25}
      },
      "terrain_bonuses": {
        "elevated": {"range": 1, "aoe_radius": 0.5}
      },
      "blocks_movement": true,
      "visual": {
        "sprite_id": "bld_tower_cannon",
        "projectile_id": "proj_cannonball"
      }
    },
    "tower_multi": {
      "name": "Multi-Shot Tower",
      "description": "Fires at multiple targets simultaneously.",
      "category": "advanced",
      "footprint": [1, 1],
      "base_cost": {"wood": 10, "stone": 15, "gold": 50},
      "base_stats": {
        "damage": 8,
        "range": 4,
        "attack_speed": 0.8,
        "shots_per_attack": 1,
        "damage_type": "physical",
        "target_type": "multi",
        "target_count": 3
      },
      "unlock_requirement": {"type": "level", "value": 10},
      "terrain_bonuses": {
        "elevated": {"target_count": 1}
      },
      "blocks_movement": true,
      "visual": {
        "sprite_id": "bld_tower_multi",
        "projectile_id": "proj_arrow"
      }
    },
    "tower_arcane": {
      "name": "Arcane Tower",
      "description": "Damage scales with typing accuracy. Perfect accuracy grants bonus damage.",
      "category": "advanced",
      "footprint": [1, 1],
      "base_cost": {"wood": 8, "stone": 12, "gold": 75},
      "base_stats": {
        "damage": 20,
        "range": 5,
        "attack_speed": 0.6,
        "shots_per_attack": 1,
        "damage_type": "magical",
        "target_type": "single",
        "accuracy_scaling": true,
        "perfect_accuracy_bonus": 1.5
      },
      "unlock_requirement": {"type": "level", "value": 12},
      "terrain_bonuses": {
        "arcane_node": {"damage": 6, "range": 1}
      },
      "blocks_movement": true,
      "visual": {
        "sprite_id": "bld_tower_arcane",
        "projectile_id": "proj_arcane_beam"
      }
    },
    "tower_holy": {
      "name": "Holy Tower",
      "description": "Bonus damage to corrupted enemies. Can purify enemy affixes.",
      "category": "advanced",
      "footprint": [1, 1],
      "base_cost": {"stone": 20, "gold": 100},
      "base_stats": {
        "damage": 18,
        "range": 4,
        "attack_speed": 0.7,
        "shots_per_attack": 1,
        "damage_type": "holy",
        "target_type": "single",
        "corruption_bonus_percent": 50,
        "purify_chance": 5
      },
      "unlock_requirement": {"type": "level", "value": 15},
      "terrain_bonuses": {
        "sacred_ground": {"purify_chance": 10, "corruption_bonus_percent": 25}
      },
      "blocks_movement": true,
      "visual": {
        "sprite_id": "bld_tower_holy",
        "projectile_id": "proj_holy_light"
      }
    },
    "tower_siege": {
      "name": "Siege Tower",
      "description": "Massive damage with charge-up mechanic. Typing words increases charge damage.",
      "category": "advanced",
      "footprint": [2, 2],
      "base_cost": {"wood": 15, "stone": 25, "gold": 125},
      "base_stats": {
        "damage": 100,
        "range": 6,
        "attack_speed": 0.15,
        "shots_per_attack": 1,
        "damage_type": "physical",
        "target_type": "single",
        "charge_mechanic": true,
        "charge_time": 5,
        "charge_damage_bonus_per_word": 0.1,
        "max_charge_multiplier": 2.0
      },
      "unlock_requirement": {"type": "level", "value": 18},
      "terrain_bonuses": {},
      "blocks_movement": true,
      "visual": {
        "sprite_id": "bld_tower_siege",
        "projectile_id": "proj_siege_bolt"
      }
    },
    "tower_poison": {
      "name": "Venomspire",
      "description": "Applies stacking poison damage over time.",
      "category": "specialist",
      "footprint": [1, 1],
      "base_cost": {"wood": 10, "stone": 15, "gold": 100},
      "base_stats": {
        "damage": 3,
        "range": 4,
        "attack_speed": 1.2,
        "shots_per_attack": 1,
        "damage_type": "poison",
        "target_type": "single",
        "poison_damage_per_tick": 5,
        "poison_duration": 5.0,
        "poison_max_stacks": 10
      },
      "unlock_requirement": {
        "type": "compound",
        "conditions": [
          {"type": "level", "value": 20}
        ]
      },
      "terrain_bonuses": {
        "swamp": {"poison_max_stacks": 2, "poison_duration": 2.0}
      },
      "blocks_movement": true,
      "visual": {
        "sprite_id": "bld_tower_poison",
        "projectile_id": "proj_venom_glob"
      }
    },
    "tower_tesla": {
      "name": "Tesla Coil",
      "description": "Chain lightning between grouped enemies.",
      "category": "specialist",
      "footprint": [1, 1],
      "base_cost": {"wood": 8, "stone": 20, "gold": 110},
      "base_stats": {
        "damage": 12,
        "range": 3,
        "attack_speed": 0.5,
        "shots_per_attack": 1,
        "damage_type": "lightning",
        "target_type": "chain",
        "chain_count": 5,
        "chain_range": 2,
        "chain_damage_falloff": 0.8
      },
      "unlock_requirement": {
        "type": "compound",
        "conditions": [
          {"type": "level", "value": 22}
        ]
      },
      "terrain_bonuses": {
        "metal_deposit": {"chain_count": 2}
      },
      "blocks_movement": true,
      "visual": {
        "sprite_id": "bld_tower_tesla",
        "projectile_id": "proj_lightning_arc"
      }
    },
    "tower_summoner": {
      "name": "Summoning Circle",
      "description": "Summons allied creatures to fight enemies.",
      "category": "specialist",
      "footprint": [2, 2],
      "base_cost": {"stone": 25, "gold": 150},
      "base_stats": {
        "damage": 0,
        "range": 0,
        "attack_speed": 0,
        "shots_per_attack": 0,
        "target_type": "none",
        "max_summons": 3,
        "summon_cooldown": 15.0,
        "default_summon": "word_warrior"
      },
      "summons": {
        "word_warrior": {"hp": 50, "damage": 8, "speed": 1},
        "letter_sprite": {"hp": 25, "damage": 15, "speed": 2, "flying": true},
        "grammar_golem": {"hp": 150, "damage": 20, "speed": 1, "taunt": true}
      },
      "unlock_requirement": {"type": "level", "value": 25},
      "terrain_bonuses": {},
      "blocks_movement": true,
      "visual": {
        "sprite_id": "bld_tower_summoner"
      }
    },
    "tower_support": {
      "name": "Command Post",
      "description": "Buffs nearby towers. Does not attack directly.",